BAKERY_ID,BAKERY_NAME,ADDRESS,DESCRIPTION,OPEN,CLOSE,URL
1,KYERI 키에리,서울특별시 용산구 이태원동 이태원로26길 16-8,"We are a bakery that crafts every treat with passion and love. From classic pastries to innovative dessert creations, we specialize in bringing a sweet touch to every occasion. Our cakes are freshly baked with the finest ingredients, and our signature red velvet and rich chocolate cakes are loved by all. Whether you're craving a quick snack or planning a special celebration, we have something for everyone!",10,21,https://cakeshop-bucket-liza.s3.ap-northeast-2.amazonaws.com/assets/img/bakery_img/kyeri.jpg
2,미니마이즈,서울특별시 용산구 녹사평대로32길 21 2층,"At our bakery, we pride ourselves on offering a warm, inviting atmosphere where delicious, freshly-baked goods come to life. We use only the finest local ingredients to craft artisan breads, rich pastries, and mouth-watering cakes. From buttery croissants to decadent cakes, we promise to satisfy your sweet tooth and leave you craving more. Visit us for an unforgettable bakery experience.",9,18,https://cakeshop-bucket-liza.s3.ap-northeast-2.amazonaws.com/assets/img/bakery_img/minimize.jpg
3,그자체 베이커리,서울특별시 광진구 화양동 33-43,"We bring together traditional baking with modern creativity. Our expert bakers craft each item with care, ensuring the perfect balance of flavor and texture. We are known for our moist, fluffy cakes, from velvety chocolate to light and zesty lemon. With a variety of cookies, tarts, and savory options, we cater to all tastes. Come enjoy our freshly brewed coffee and a slice of your favorite treat!",12,20,https://cakeshop-bucket-liza.s3.ap-northeast-2.amazonaws.com/assets/img/bakery_img/keujaje.jpg
4,러시아 케이크,서울특별시 중구 을지로42길 7,"We are your destination for artisan cakes, pastries, and sweet treats that look as good as they taste. Inspired by nature, we use organic, locally-sourced ingredients to create everything from delicate fruit tarts to decadent layered cakes. Specializing in custom cakes for any occasion, we add a personal touch to every order. We believe in celebrating life's sweet moments with love and creativity.",8,17,https://cakeshop-bucket-liza.s3.ap-northeast-2.amazonaws.com/assets/img/bakery_img/russian.jpg
5,어피스앤드피스,서울특별시 성동구 성수일로12길 17,"At our bakery, indulgence meets innovation. Whether you're in the mood for a slice of rich cheesecake or a light, fruity cupcake, we've got you covered. Our bakers push the boundaries of flavor and presentation, making every treat a work of art. We're passionate about using high-quality ingredients, and our menu is constantly evolving with new seasonal delights. Stop by for a taste of happiness!",10,18,https://cakeshop-bucket-liza.s3.ap-northeast-2.amazonaws.com/assets/img/bakery_img/piece.jpg